标题,链接
http://ent.people.com.cn/n1/2023/0621/c1012-40018296.html,北京：推动文物旧址活化利用
http://opinion.people.com.cn/n1/2023/0621/c1003-40018278.html,以文润心，提升文化的育人功能
http://opinion.people.com.cn/n1/2023/0621/c1003-40018274.html,推动北京“新两翼”建设取得更大突破
http://opinion.people.com.cn/n1/2023/0621/c1003-40018275.html,不断增强生物多样性治理能力
http://opinion.people.com.cn/n1/2023/0621/c1003-40018276.html,村里的球赛何以火起来
http://leaders.people.com.cn/n1/2023/0619/c58278-40016584.html,江西峡江县网友：老市场去年被拆除 新市场至今未动工
http://leaders.people.com.cn/n1/2023/0612/c58278-40011201.html,辽宁大连试点开通人民网“领导留言板”县长留言板块
http://finance.people.com.cn/n1/2023/0621/c1004-40018680.html,RCEP全面生效 为我国外贸发展注入新动能
http://finance.people.com.cn/n1/2023/0621/c1004-40018680.html,《区域全面经济伙伴关系协定》（RCEP）对15个签署国全面生效已有一段时间。在记者采访过程中，切实感受到了新一轮政策红利为外贸企业带来的变化。专家表示，按照RCEP全面生效后，关税平均降低10%测算，根据关税变化程度与贸易量变化之间的关系，估计未来我国与RCEP成员国之间的贸易量还有20%以上的增量空间，将为我国外贸发展注入新动能。
http://finance.people.com.cn/n1/2023/0621/c1004-40018654.html,一季度银行办理非现金支付笔数增长18.46%
http://finance.people.com.cn/n1/2023/0621/c1004-40018653.html,监管部门:加大直播带货广告、弹窗广告整治
http://finance.people.com.cn/n1/2023/0621/c1004-40018675.html,人居环境改善 数字乡村为生活添彩
http://finance.people.com.cn/n1/2023/0621/c1004-40018677.html,民营企业转型升级 “拼”出实体经济新图景
http://env.people.com.cn/n1/2023/0621/c1010-40018636.html,福建厦门：做足“水文章” 答好“生态卷”
http://finance.people.com.cn/n1/2023/0621/c1004-40018643.html,天宫空间站电推进发动机首次实现在轨“换气”
http://finance.people.com.cn/n1/2023/0621/c1004-40018643.html,近日，天宫空间站电推进系统气瓶完成在轨安装任务，航天科技集团六院801所首次采用“换气”的方式完成电推进系统推进剂氙气的补充。该团队创造性地提出了一种简化版的浮动对接形式，即通过粗定位导向装置实现机械臂初始定位，再通过自主精定位进一步修正。这种形式极大提高了对接的可靠性，即便在轨多次拆装也能保证精度满足要求。
http://finance.people.com.cn/n1/2023/0621/c1004-40018646.html,我科学家发现天文测距最好标准烛光
http://finance.people.com.cn/n1/2023/0621/c1004-40018668.html,“干细胞动物园”里有张发育时间表
http://finance.people.com.cn/n1/2023/0621/c1004-40018671.html,我国首台桥梁换运架一体机投用
http://kpzg.people.com.cn/n1/2023/0621/c404214-40018379.html,人体的这个器官很敏感，要善待！
http://kpzg.people.com.cn/n1/2023/0621/c404214-40018371.html,高考过后如何帮助肥胖考生恢复身体健康？
http://society.people.com.cn/n1/2023/0621/c1008-40018656.html,绘就赣中福地绿色发展新画卷
http://society.people.com.cn/n1/2023/0621/c1008-40018656.html,保护环境，功在千秋。作为全国首批生态文明建设典范城市，素有“中国福文化之乡”“赣中福地”美誉的江西省安福县，辖区内有5A级风景名胜区――武功山景区，还有安福人民的母亲河――泸水河。凭着得天独厚的风景旅游资源和优越的生态环境，安福县委、县政府提出了“生态立县、产业强县、旅游兴县”的主战略。
http://society.people.com.cn/,社会・法治
http://society.people.com.cn/n1/2023/0621/c1008-40018623.html,安徽：保护生态环境也是优化营商环境
http://society.people.com.cn/n1/2023/0621/c1008-40018619.html,山东德州:强化府院协同联动 合力化解行政争议
http://society.people.com.cn/n1/2023/0621/c1008-40018640.html,湖南三被告人犯非法捕捞水产品罪获刑
http://society.people.com.cn/n1/2023/0621/c1008-40018651.html,青岛海事法院：一纸强制令了断5万吨货物纠纷
http://society.people.com.cn/n1/2023/0621/c1008-40018658.html,广东佛山中院发布中小微企业“救治指南”
http://edu.people.com.cn/n1/2023/0620/c1006-40018235.html,教育部公布2023年高考网上咨询周时间安排
http://edu.people.com.cn/n1/2023/0620/c1006-40018235.html,“2023年高考网上咨询周”活动将于6月22日至28日在教育部“阳光高考信息平台”举行。活动期间，平台将提供文字问答和视频直播两种方式，文字问答咨询时间为9点至17点，鼓励高校积极采用视频直播方式开展招生宣传和咨询。各高校将加强线上招生宣传，为考生、家长提供准确权威、周到细致的志愿填报咨询指导和服务。
http://edu.people.com.cn/,教育
http://edu.people.com.cn/GB/1053/index.html,滚动新闻
http://edu.people.com.cn/n1/2023/0620/c1006-40018233.html,2023年全国教育数字化现场推进会议召开
http://edu.people.com.cn/n1/2023/0621/c1006-40018239.html,上海市教育考试院：网传中考泄题为不实信息
http://edu.people.com.cn/n1/2023/0620/c1006-40018236.html,留学生毕业典礼上“秀”诗词：愿做一名文化使者
http://edu.people.com.cn/n1/2023/0621/c1006-40018238.html,幼儿误食避孕药有何后果？专家：危险等级较高
http://edu.people.com.cn/n1/2023/0620/c1006-40018232.html,大学生毕业返乡做“莓”创客 新技术服务“土”产业
http://world.people.com.cn/n1/2023/0621/c1002-40018579.html,外交部美大司司长杨涛介绍中美五项共识
http://world.people.com.cn/n1/2023/0621/c1002-40018579.html,2023年6月19日晚，外交部美大司杨涛司长就美国国务卿布林肯访华向中外媒体吹风。杨涛介绍了中美双方达成的五项共识。
http://world.people.com.cn/,国际
http://world.people.com.cn/GB/157278/index.html,滚动新闻
http://world.people.com.cn/GB/386750/index.html,中国外交
http://world.people.com.cn/n1/2023/0621/c1002-40018335.html,中法文化旅游论坛在法国举行
http://world.people.com.cn/n1/2023/0621/c1002-40018468.html,中方呼吁国际社会支持中非共和国和平进程
http://world.people.com.cn/n1/2023/0621/c1002-40018424.html,意大利中餐业者打造新派“中国味道”
http://world.people.com.cn/n1/2023/0621/c1002-40018307.html,联合国会员国通过保护公海生物多样性协定
http://world.people.com.cn/n1/2023/0621/c1002-40018308.html,报告：兴都库什―喜马拉雅地区冰川加速消融
http://world.people.com.cn/n1/2023/0621/c1002-40018303.html,法国第七届“科技万岁”科技创新展举行
http://world.people.com.cn/n1/2023/0621/c1002-40018303.html,法国第七届“科技万岁”科技创新展日前在巴黎凡尔赛门展览中心举行。作为欧洲最大的科技展会之一，今年的科技创新展涵盖人工智能、能源与气候、未来运动等十大主题，吸引了来自全球的2400多家初创科技企业和20多个行业的领军企业参展，其中不乏中国知名企业。
http://world.people.com.cn/,国际
http://world.people.com.cn/n1/2023/0621/c1002-40018304.html,德国推动初创企业快速发展
http://world.people.com.cn/n1/2023/0621/c1002-40018306.html,伊拉克努力改善电力供应
http://world.people.com.cn/n1/2023/0621/c1002-40018475.html,洪都拉斯发生监狱暴乱至少41人死亡
http://world.people.com.cn/n1/2023/0621/c1002-40018441.html,约旦河西岸枪击事件致4名以色列人死亡
http://world.people.com.cn/n1/2023/0621/c1002-40018506.html,芬兰总统任命新一届联合政府 奥尔波出任总理
http://military.people.com.cn/n1/2023/0621/c1011-40018738.html,空军航空大学探索跨专业跨兵种跨战区联教联训新路
http://military.people.com.cn/n1/2023/0621/c1011-40018738.html,“三代机飞行员要给有关作战保障专业学员授课了！”日前，一条教学信息在空军航空大学学员中引发广泛关注。飞行员给飞行学员授课是常态，但给有关作战保障专业学员授课却是新鲜事。这一教学方式的变化，源于该校对打仗型人才培养的深刻思考。
http://military.people.com.cn/,军事
http://military.people.com.cn/GB/172467/index.html,滚动新闻
http://military.people.com.cn/n1/2023/0621/c1011-40018737.html,武警青海总队突出检视整改推进主题教育走深走实
http://military.people.com.cn/n1/2023/0621/c1011-40018740.html,机关干部蹲点调研，要以成效打动官兵
http://military.people.com.cn/n1/2023/0621/c1011-40018743.html,海军某旅：向科技要管理效益为基层减负
http://military.people.com.cn/n1/2023/0621/c1011-40018744.html,解放军总医院海南医院优质医疗资源向一线延伸
http://military.people.com.cn/n1/2023/0621/c1011-40018756.html,美F-15EX战斗机延迟交付
/n1/2023/0618/c32306-40016419.html,强观察丨5月数据发布，中国经济发展态势如何？
/n1/2023/0618/c32306-40016419.html,6月15日，国家统计局发布了今年5月份国民经济运行情况。数据显示，5月份，稳增长稳就业稳物价政策持续显效，生产需求稳步恢复，就业物价总体稳定，转型升级持续推进，主要生产需求指标环比增速不同程度改善，经济运行延续恢复态势。
/32306/index.html,强国新闻
/n1/2023/0617/c32306-40016151.html,防治荒漠化知多少？
/n1/2023/0616/c32306-40014893.html,强观察｜这些返回舱里的“神器”为航天员保驾护航
/n1/2023/0613/c32306-40012487.html,4943.88亿元！黄河流域生态效益显著增长
/n1/2023/0609/c32306-40010158.html,强观察｜高考招生有变化，这些新增专业你知道么？
/n1/2023/0609/c32306-40010255.html,强观察丨麦收正当时，如何确保颗粒归仓？
http://ent.people.com.cn/n1/2023/0621/c1012-40018608.html,文化内涵是传统节日的灵魂
http://ent.people.com.cn/n1/2023/0621/c1012-40018608.html,散落在岁时“点”上的中国传统节日，承载着丰富的文化内涵和重要的价值观念，凝结着中华民族的文化血脉和思想精华。节日即纽带，联结着传统与现代、过去和未来，润物无声地滋养着世代人民，成为民众安顿个体精神、休憩心灵的重要“节”点。每当节日临近，如何过一个有意义的传统节日总会成为人们热议的话题。过节过的是什么？是文化的传承、精神的延续，是不忘初心，方得始终。
http://ent.people.com.cn/n1/2023/0621/c1012-40018598.html,莫让商业利益干扰少儿节目
http://ent.people.com.cn/n1/2023/0621/c1012-40018591.html,当代文学与传统艺术“深情相拥”
http://ent.people.com.cn/n1/2023/0621/c1012-40018602.html,把传统文化种子播撒在人们心田
http://ent.people.com.cn/n1/2023/0621/c1012-40018601.html,电影成为中国文化国际传播新力量
http://ent.people.com.cn/n1/2023/0621/c1012-40018639.html,国家文物局在京召开长城保护工作会议
http://ent.people.com.cn/n1/2023/0621/c1012-40018399.html,杭州亚运会筹备工作已进入冲刺阶段
http://ent.people.com.cn/n1/2023/0621/c1012-40018399.html,还有不到100天，杭州亚运会的圣火就将点燃，西子湖畔将吹起“亚洲雄风”。自2015年9月申办成功以来，杭州携手宁波、温州、金华、绍兴、湖州5个协办城市，向着“办好一个会，提升一座城”的办赛目标稳步迈进。而今，杭州亚运会筹备工作已进入冲刺阶段，亚运六城正携手奋战、热情邀约，努力呈现一届具有“中国特色、亚洲风采、精彩纷呈”的体育文化盛会。
http://ent.people.com.cn/n1/2023/0621/c1012-40018609.html,全国和美乡村篮球大赛开赛
http://ent.people.com.cn/n1/2023/0621/c1012-40018495.html,亚洲藤球运动员浙江金华开赛
http://ent.people.com.cn/n1/2023/0621/c1012-40018490.html,中国轮椅女篮创世锦赛最佳战绩
http://ent.people.com.cn/n1/2023/0621/c1012-40018402.html,环西自行车挑战赛・北京昌平举行
http://ent.people.com.cn/n1/2023/0621/c1012-40018503.html,国足主帅扬科维奇：“路很长，我们继续努力”
http://health.people.com.cn/n1/2023/0621/c14739-40018302.html,让更多协同发展的红利惠及民生
http://health.people.com.cn/n1/2023/0621/c14739-40018302.html,一直以来，各地患者得了病，总喜欢去北京大医院就医，随着分级诊疗的推行，近些年这种状况有所改变。拿河北来说，河北环绕京津，离得近，过去北京大医院的就医者相当多来自河北。现在，随着京津冀医疗协同步伐的加快，很多患者不用再奔波着往北京赶了。
http://health.people.com.cn/n1/2023/0621/c14739-40018584.html,我国多渠道构建猴痘监测预警体系
http://health.people.com.cn/n1/2023/0621/c14739-40018381.html,为积极应对人口老龄化贡献力量
http://health.people.com.cn/n1/2023/0621/c14739-40018426.html,这四种儿童高发肿瘤要留意
http://health.people.com.cn/n1/2023/0621/c14739-40018435.html,从戒烟大赛 看如何科学战胜烟瘾
http://health.people.com.cn/n1/2023/0621/c14739-40018437.html,体内“穿山甲”微型机器人问世
